MuiTypography-root	Quote_blockquote__Uftnf	MuiTypography-root 2	MuiTypography-root 3	MuiTypography-root 4	MuiTypography-root href	MuiTypography-root 5	MuiTypography-root 6
—	I won't talk to you about what I know about [Roswell], but it’s very interesting... [Asked by his son to declassify it]... Well, I'll have to think about that one.	Donald Trump	US President (R)	6/19/2020 |	https://www.nbcnews.com/politics/donald-trump/trump-says-he-s-heard-very-interesting-things-about-roswell-n1231521	NBC News	
—	There was so much [debris at Roswell]. It was scattered over such a vast area [12 football fields]. We found a piece of metal, about a foot and a half or two feet wide, about two to three feet long, felt like it had nothing in your hands. It wasn't any thicker than the foil out of a pack of cigarettes. The thing that got me is that you couldn't even bend it, you couldn't dent it, even a sledge hammer would bounce off of it... All I could do was keep my mouth shut. Being an intelligence officer I was familiar with every, just about all the materials used in aircraft, and in air travel, this was nothing like that. It was not anything from this earth, that I am quite sure of.	Jesse Marcel	Major US Air Force	[1993] |	https://www.amazon.com/Phenomenon-John-Podesta/dp/B08HR9BVNM	The Phenomenon	Chief Intelligence Officer, Roswell Army Air Field
—	"Mr. Davis, who now works for Aerospace Corporation, a defense contractor, said he gave a classified briefing to a Defense Department agency as recently as March about retrievals from “off-world vehicles not made on this earth.”

Mr. Davis said he also gave classified briefings on retrievals of unexplained objects to staff members of the Senate Armed Services Committee on Oct. 21, 2019, and to staff members of the Senate Intelligence Committee two days later."	The New York Times	No Longer in Shadows, Pentagon’s U.F.O. Unit Will Make Some Findings Public	7/23/2020 |	https://www.nytimes.com/2020/07/23/us/politics/pentagon-ufo-harry-reid-navy.html	The New York Times	
—	Even before this ‘whistleblower’ legislation was signed into law, credible individuals were providing Congress information alleging that the US government has recovered extraterrestrial technology. This process began in 2019 when I brought astrophysicist Dr. Eric Davis to Capitol Hill to meet with staff from the Senate Intelligence and Armed Services committees. Dr. Davis, author of the famous Wilson-Davis memo, provided specific information lending credence to sensational reports that an official US government program is actively seeking to exploit recovered technology that was fashioned by some other species or perhaps advanced AI machines.	Christopher Mellon	Dep. Asst. Secretary of Defense for Intelligence	12/24/2022 |	https://www.christophermellon.net/post/unprecedented-uap-legislation	Unprecedented UAP Legislation	
—	We have crash retrievals and they have been analysed and unfortunately our laboratory diagnostic technologies and our material sciences and the understanding of physics that we had were not advanced enough to be able to make heads or tails of what it is, of what they had their hands on. [Editor's note: Mr. Davis retains his security clearance and government contractor employment despite making this public claim.]	Dr. Eric Davis	Astrophysicist	|	https://www.amazon.com/Plain-Sight-investigation-impossible-science/dp/1460759060	In Plain Sight, p 155	Consultant to AATIP, Pentagon UAP study program
—	"[Rogan]: [What about the] possibility that we have obtained this extraterrestrial craft and are in the process of trying to back engineer it? 

[Mellon]: That's a really ticklish question for me and awkward. And if I were to say 'Yep, it's true' nobody would believe me. If I really knew, I couldn't say yes. And it's hard to give good answers to that question. I think it's plausible. I don't think people should rule that out. There's enough information to say that may have happened. We may have recovered some debris... It would be so deeply squirreled away you wouldn't be able to bring in the best scientists, you wouldn't be able to bring in world class scientists, you would have a few people available in some aerospace company and they would be hamstrung in their ability to test and examine the material and so forth. It would just be locked away somewhere."	Christopher Mellon	Dep. Asst. Secretary of Defense for Intelligence	5/30/2021 |	https://www.youtube.com/watch?v=RjV-PZyUwlY	The Joe Rogan Experience	
—	I talk over the following weeks with other anonymous insiders. To protect their identities, I cannot reveal much of the astonishing detail of what they told me but I am left in no doubt that they all assert that the US military, almost certainly the US Air Force, is in possession of retrieved non-terrestrial — alien — technology. Intriguingly, what I am told matches the claims made in the Admiral Wilson memo, that a private aerospace company now exercises control over this alien technology.	Ross Coulthart	Investigative journalist	2021 |	https://www.amazon.com/Plain-Sight-investigation-impossible-science/dp/1460759060	In Plain Sight, p 286	Author of In Plain Sight
—	I was told for decades that Lockheed had some of these retrieved materials. And I tried to get, as I recall, a classified approval by the Pentagon to have me go look at the stuff. They would not approve that. I don't know what all the numbers were, what kind of classification it was, but they would not give that to me. That's why I wanted AATIP [to get Special Access Program status] to take a look at it. But they wouldn't give me the clearance.	Harry Reid	US Senator (D)	5/1/2021 |	https://www.uap.guide/quotes/USG-may-have-materials	The New Yorker	Senate Majority Leader
60 Minutes							
Length: 14 minutes | 5/16/2021							
This is the easiest place to start with UAP. As the issue became more prominent with the release and authentication of three UAP videos by the Pentagon, 60 minutes took up the investigation including the Nimitz incident. For many this was almost as important as the 2017 New York Times article disclosing AATIP for bringing the discussion of UAP into the mainstream. Per 60 minutes: 'We have tackled many strange stories on  60 minutes but perhaps none like this. It's the story of the US government's grudging  acknowledgment of unidentified aerial phenomena. UAP more commonly known as UFOs after decades  of public denial the Pentagon now admits there's something out there and the  US Senate wants to know what it is.'							
UFOs: Investigating the Unknown							
Length: 5 episodes | 2/16/2023							
Produced by National Geographic and led by Leslie Kean, this five part docuseries is the most credible and up to date introduction to UAP.							
Watch on Hulu					https://www.hulu.com/series/ufos-investigating-the-unknown-4c1070e7-5b4d-46e1-a5ee-b9eb0c7db18c		
In Plain Sight							
Length: 300 pages | 2021							
Award-winning investigative journalist Ross Coulthart compiles one of the most authoritative modern accounts of the UAP issue. If you only read one book about UAP, this should be it.							
Buy on Amazon					https://www.amazon.com/Plain-Sight-investigation-impossible-science/dp/1460759060		
Length: 2 seasons @ 45 min x 8 episodes | 7/5/2019							
Investigation by ex-government officials interviewing primarily military witnesses of highly credible UAP cases for the public record. Features the former head of the Pentagon UAP study group Luis Elizondo and former Deputy Assistant Secretary of Defense for Intelligence, Chris Mellon, who oversaw black programs at the Pentagon. According to Mellon, this series was created with the intention that it could be viewed by Congressional staffers and easily shown to members, to prompt further action by Congress to investigate UAP. It is a highly credible team and the results of their investigation are extremely compelling. It should be noted the History channel production manages to come off as a little sensationalized even though the data is sensational.							
Buy Season 1 on Amazon					https://www.amazon.com/gp/video/detail/B07SH9SB24/ref=atv_dp_season_select_s1		
Buy Season 2 on Amazon					https://www.amazon.com/gp/video/detail/B08CSS9BJQ/ref=atv_dp_season_select_s2		
UFOs: Generals...							
Length: 300 pages | 2010							
Leslie Kean, a veteran investigative reporter who has been at the forefront of government disclosure of UAP, reviewed hundreds of government documents, aviation reports, radar data, and case studies with  physical evidence. She interviewed dozens of high-level officials and aviation witnesses from around the world. Among them, five Air Force generals and a host of high-level sources—including Fife Symington III, former governor of Arizona, and Nick Pope, former head of the British Defence Ministry’s UFO Investigative Unit. This groundbreaking book sets a gold standard for the modern, investigative journalism approach to understanding UAP.							
Buy on Amazon					https://www.amazon.com/UFOs-Generals-Pilots-Government-Officials/dp/0307717089		
Office of Director of National Intelligence | 10/17/23		2023 Annual Report on Unidentified Aerial Phenomena			https://www.dni.gov/files/ODNI/documents/assessments/FY2023-Consolidated-Annual-Report-UAP-Oct2023.pdf		
Office of Director of National Intelligence | 01/12/23		2022 Annual Report on Unidentified Aerial Phenomena			https://www.dni.gov/files/ODNI/documents/assessments/Unclassified-2022-Annual-Report-UAP.pdf		
Office of Director of National Intelligence | 06/25/21		Preliminary Assessment: Unidentified Aerial Phenomena			https://www.dni.gov/files/ODNI/documents/assessments/Prelimary-Assessment-UAP-20210625.pdf		
Office of Director of National Intelligence | 06/25/21		Preliminary Assessment: Unidentified Aerial Phenomena (redacted classified version)			https://documents2.theblackvault.com/documents/odni/DEOM-2021-00006.pdf		
Department of Defense | 04/27/20		Statement on the Release of Historical Navy Videos			https://www.defense.gov/News/Releases/Release/Article/2165713/statement-by-the-department-of-defense-on-the-release-of-historical-navy-videos/		
National Security Agency | 1999		French Government UFO Study			https://www.nsa.gov/portals/75/documents/news-features/declassified-documents/ufo/french_gov_ufo_study.pdf		
GEPAN | 1999		The Cometa report - UFOs and Defense, What Should We Prepare for?			https://ia800403.us.archive.org/17/items/pdfy-NRIQie2ooVehep7K/The%20Cometa%20Report%20%5BUFO%27s%20And%20Defense%20-%20What%20Should%20We%20Prepare%20For%5D.pdf		
US Air Force | 1985		Fact sheet for Project Blue Book			https://www.archives.gov/research/military/air-force/ufos		
Eric W Davis | 10/16/2002		Eric W Davis + Admiral Wilson meeting notes			https://www.documentcloud.org/documents/6185702-Eric-Davis-meeting-with-Adm-Wilsons		