MuiTypography-root	Quote_blockquote__Uftnf	MuiTypography-root 2	MuiTypography-root 3	MuiTypography-root 4	MuiTypography-root href	MuiTypography-root 5	MuiTypography-root 6
—	[Commenting on ]If this were some type of aircraft with a conventional propulsion system, we would definitely see some type of heat signature [on the FLIR video]. Everything we know about propulsion systems is that they create an intense amount of heat.	Christopher Cooke	Lt Colonel, US Marines	2019 |	https://www.amazon.com/UFO-Fleet/dp/B07SH9SB24	Unidentified S1 Ep 4: UFO Fleet	Pilot
—	The fact that [the ] was just getting himself on his wingtip [at 90 degrees], with no turn, while staying in the exact same point, isn't how aircraft work.	Ryan Graves	Lieutenant, US Navy	2019 |	https://www.amazon.com/UFO-Fleet/dp/B07SH9SB24	Unidentified S1 Ep 4: UFO Fleet	F/A-18 Pilot
—	[Commenting on the ] It is definitely rotating, or changing angle of bank. It appears to have stopped moving quickly across the horizon. I have no idea. I have always been skeptical... but I have never seen anything remotely like what I saw today. I am a lot more convinced now that these vehicles do exist.	Christopher Cooke	Lt Colonel, US Marines	2019 |	https://www.amazon.com/UFO-Fleet/dp/B07SH9SB24	Unidentified S1 Ep 4: UFO Fleet	Pilot
—	On a clear, sunny day in April 2014, two F/A-18s took off for an air combat training mission off the coast of Virginia. The jets, part of my Navy fighter squadron, climbed to an altitude of 12,000 and steered towards Warning Area W-72, an exclusive block of airspace ten miles east of Virginia Beach. All traffic into the training area goes through a single GPS point at a set altitude — almost like a doorway into a massive room where military jets can operate without running into other aircraft. Just at the moment the two jets crossed the threshold, one of the pilots saw a dark gray cube inside of a clear sphere — motionless against the wind, fixed directly at the entry point. The jets, only 100 feet apart, zipped past the object on either side. The pilots had come so dangerously close to something they couldn’t identify that they terminated the training mission immediately and returned to base.	Ryan Graves	Lieutenant, US Navy	2/28/23 |	https://www.politico.com/news/magazine/2023/02/28/ufo-uap-navy-intelligence-00084537	Politico	F/A-18 Pilot
Not new							
—	As a pilot and former Air Force officer, I can definitely say that this craft [Phoenix Lights incident] did not resemble any man-made object I'd ever seen. And it was certainly not high-altitude flares [as stated by the Air Force], because flares don't fly in formation.	Fife Symington	Governor, Arizona	1997 |	https://www.amazon.com/Plain-Sight-investigation-impossible-science/dp/1460759060	In Plain Sight p 119	
—	My position both privately and publicly expressed over the last dozen years or more [about the 1980 Rendlesham forest incident at RAF Bentwaters], is that there are only two possibilities, either: a) An intrusion into our air space and a landing by unidentified craft took place at Rendlesham, as described. Or: b) The Deputy Commander of an operational, nuclear armed, US Air Force base in England, and a large number of his enlisted men, are lying. Either of these simply must be 'of interest to the Ministry of Defence,' which has been repeatedly denied, in precisely those terms.	Lord Hill-Norton	Admiral, UK Chief of the Defence Staff	10/22/1997 |	https://www.amazon.com/UFOs-Generals-Pilots-Government-Officials/dp/0307717089	UFOs: Generals ... p 173	
—	"[Tape recording during Rendlesham incident with other soldiers] 
I see it, too... It's back again... It's coming this way... There is no doubt about it... This is weird... It looks like an eye winking at you... It almost burns your eyes... He's coming towards us now... [panic] Now we are observing what appears to be a beam coming down to the ground... One object still hovering over Woodbridge base... beaming down."	Charles Halt	Lt Colonel, US AIr Force	12/28/1980 |	https://www.amazon.com/UFOs-Generals-Pilots-Government-Officials/dp/0307717089	UFOs: Generals ... p 170	Deputy Base Commander, RAF Bentwaters
—	I was the senior security officer in charge of Woodbridge base security [Rendlesham]... I held a top-secret US and NATO security clearance... It maneuvered through the trees and shot off at an unbelievable rate of speed. It was gone in the blink of an eye. In my logbook, which I still have, I wrote 'Speed Impossible.' I subsequently learned that other personnel based at Bentwaters and Woodbridge, all trained observers, had witnessed this takeoff.	James Penniston	Sergeant, US Air Force	2010 |	https://www.amazon.com/UFOs-Generals-Pilots-Government-Officials/dp/0307717089	UFOs: Generals ... p 179	
—	I spoke to former RAF radar operator Nigel Kerr [about Rendlesham]... for three or four sweeps, something did show up, directly over the base. But it faded away... Arguably the most critical piece of evidence... The Defence Intelligence Staff had assessed the radiation readings taken at the landing site and judged them to be 'significantly higher than the average background,'... about seven times what would have been expected for the area concerned.	Nick Pope	UK Ministry of Defense (Ret.)	2010 |	https://www.amazon.com/UFOs-Generals-Pilots-Government-Officials/dp/0307717089	UFOs: Generals ... p 171	
—	Behind the scenes, high ranking Air Force officers are soberly concerned about the UFOs. But through official secrecy and ridicule, many citizens are led to believe the unknown flying objects are nonsense... To hide the facts, the Air Force has silenced its personnel.	R.H. Hillenkoetter	Director of the Central Intelligence Agency, Vice Admiral US Navy	2/28/1960 |	https://timesmachine.nytimes.com/timesmachine/1960/02/28/119097456.pdf?pdf_redirect=true&ip=0	The New York Times	
—	If we persist in refusing to recognize the existence of the UFOs, we will end up, one fine day, by mistaking them for the guided missiles of an enemy — and the worst will be upon us.	L.M. Chassin	General	1960 |	http://www.ufoevidence.org/documents/doc598.htm	US Air Force	NATO coordinator of Allied Air Service
—	No agency in this country or Russia is able to duplicate at this time the speeds and accelerations which radars and observers indicate the flying objects are able to achieve. There are signs that an intelligence directs these objects because of the way they fly. The way they change position in formations would indicate that their motion is directed.	Delmer Fahrney	Admiral	1/1/1957 |	https://www.amazon.com/Plain-Sight-investigation-impossible-science/dp/1460759060	In Plain Sight p 47	Head of Navy guided missile program
—	Sightings of unexplained objects at great altitudes and traveling at high speeds in the vicinity of major U.S. defense installations are of such nature that they are not attributable to natural phenomena or known types of aerial vehicles.	H. Marshall Chadwell	Asst. Director CIA, Scientific Intelligence	12/2/1952 |	https://www.nytimes.com/2019/01/15/arts/television/project-blue-book-history-true-story.html	The New York Times	
—	Probably what we saw [in 1952 over Washington, DC] was from somewhere else. Look the Air Force is a very deadly being when it comes to intercepting an unknown. If it proves hostile we are going to shoot it down. Other than that, no problem.	William Coleman	Colonel, US Air Force	10/6/2020 |	https://www.amazon.com/Phenomenon-John-Podesta/dp/B08HR9BVNM	The Phenomenon	Public Spokesman for Project Blue Book
—	[In 1952 over Washington, DC], I am convinced they are solid objects. I am convinced that they are probably from another planet or outer space somewhere. I have always felt that way since that night.	Albert M Chop	Press Spokesman for Project Blue Book	10/6/2020 |	https://www.amazon.com/Phenomenon-John-Podesta/dp/B08HR9BVNM	The Phenomenon	
—	[At an Air Force base in Germany 1952] Unlike fighters they would almost stop in their forward velocity and change 90 degrees, sometimes in their flight path... We had practically all the fighters we could muster on the base up climbing as high as they could climb with guys that have binoculars with them... they were round in shape and very metallic looking. And they would come over and do the same maneuvers that we make except everyone once in a while one of them goes 'zip' [hand motion]. And you just can't do that in a fighter.	Gordon Cooper	NASA Astronaut and US Air Force fighter pilot	1998 |	https://www.amazon.com/Phenomenon-John-Podesta/dp/B08HR9BVNM	The Phenomenon	
—	They came in like this and went out like this [makes a v]. There would be no way to make a complete reversal or 90 degree turn at 12,000 miles [per hour] or greater without making the occupants juice on the wall. That kind of really shook us up... Nothing could have gotten to that degree of scientific progress without some of the intermediate steps becoming public knowledge. We just knew that they were not from this planet.	William Nash	Pan American pilot, former fighter pilot	10/6/2020 |	https://www.amazon.com/Phenomenon-John-Podesta/dp/B08HR9BVNM	The Phenomenon	
—	Since 1947 we have received and analyzed between 1,000 and 2,000 reports... However there have been a certain percentage of this volume of these reports, that have been made by credible observers of relatively incredible things. We can say that the recent sightings are in no way connected with any secret development by any department by the United States.	John Samford	Director of Intelligence, Major General US Air Force	1952 |	https://www.amazon.com/Phenomenon-John-Podesta/dp/B08HR9BVNM	The Phenomenon	
—	Not entirely impossible that the objects sighted may possibly be ships from another planet such as Mars.	John Samford	Director of Intelligence, Major General US Air Force	1952 |	https://www.amazon.com/UFOs-Generals-Pilots-Government-Officials/dp/0307717089	UFOs: Generals ...	
—	This [Evelyn and Paul Trent case] is one of the few UFO cases in which all factors investigated, geometric, psychological, and physical, appear to be consistent with the assertion that an extraordinary flying object, silvery, metallic, disc-shaped, tens of meters in diameter, and evidently artificial flew within sight of two witnesses.	Air Force UAP inquiry	Case 46: McKinville. Oregon	5/11/1950 |	http://www.project1947.com/shg/condon/case46.html	Condon Report	
—	The [UAP] phenomenon reported is something real and not visionary or fictitious... extreme rates of climb, maneuverability (particularly in roll), and motion which must be considered evasive when sighted or contacted by friendly aircraft and radar... [which] lend belief to the possibility that some of the objects are controlled either manually, or remotely.	Nathan Twining	Commander of Air Materiel Command, Lt. General US Air Force	9/23/1947 |	https://www.documentcloud.org/documents/20797978-twining-memo	US Air Force	
—	I kept looking for their tails. They don't have any tails. I thought well something is wrong with my eyes. They seemed to flip and flash in the sun just like a mirror. I'd be glad to confirm it with my hands on a bible because I did see it. Whether it has anything to do with our army or some foreign country, I don't know.	Kenneth Arnold	Pilot	1947 |	https://www.amazon.com/Phenomenon-John-Podesta/dp/B08HR9BVNM	The Phenomenon	
Global phenomena							
—	All over the world. There have been sightings all over the world.	John Ratcliffe	Director National Intelligence	3/22/2021 |	https://www.theguardian.com/us-news/2021/mar/22/us-government-ufo-report-sightings	The Guardian	
—	Allies have seen these. China has created its own version of a UAP task force, so clearly a number of countries have seen objects in their airspace that they can't identify.	Scott Bray	Deputy Director Navy Intelligence	5/17/2022 |	https://www.youtube.com/watch?v=aSDweUbGBow	Congressional hearings	
—	Both countries [China and Russia] have active UFO groups... They certainly have had their own incidents over the years... France has had an official UFO investigative group for decades. This is very much a global phenomenon.	Christopher Mellon	Dep. Asst. Secretary of Defense for Intelligence	5/30/2021 |	https://www.youtube.com/watch?v=RjV-PZyUwlY	The Joe Rogan Experience	
—	For twenty-one years, from 1983 to 2004, I was the director of the French program to investigate and analyze unidentified aerospace phenomena...  The existence of UFOs is without question. UFO's seem to be 'artificially controlled objects' and their physical characteristics can be measured by our detection systems — particularly radar. They display a physics seemingly far different from that which we employ in our most technologically advanced countries. Ground and on-board radar show that their performance greatly exceed our best aeronautical and space capabilities. These capabilities include stationary and silent flights, accelerations and speeds defying the laws of inertia...	Jean-Jacques Velasco	Director GEPAN	2010 |	https://www.amazon.com/UFOs-Generals-Pilots-Government-Officials/dp/0307717089	UFOs: Generals ... p 128	Head of French UAP program
—	In 10 of the 11 cases [investigated], the conclusion was that the witnesses had witnessed a material phenomenon that could not be explained as a natural phenomenon or a human device. One of the conclusions of the total report is that behind the overall phenomenon there is a 'flying machine... whose modes of sustenance and propulsion are beyond our knowledge.'	National Security Agency	Declassified summary of GEPAN report, French Government UAP office	1999 |	https://www.nsa.gov/portals/75/documents/news-features/declassified-documents/ufo/french_gov_ufo_study.pdf	Document	
—	Hundreds of people [in 1989] saw a majestic triangular craft with a span of approximately 120 feet, powerful beaming spotlights, moving very slowly without making any significant noise, but, in several cases, accelerating to very high speeds. [In] the following days and months, many more sightings would follow... On one occasion two F-16s registered changes in speed and altitude which were well outside the performance envelope of existing aircraft.	Wilfred De Brouwer	Deputy Chief of Staff, Major General Belgian Air Force	2010 |	https://www.amazon.com/Plain-Sight-investigation-impossible-science/dp/1460759060	In Plain Sight, p 89	
—	The crafts performed in ways not possible by known technology. They were able to remain stationary and hover, even in unusual positions such as vertical and/or banking at 45 degrees or more. They could fly at slow speeds and accelerate extremely fast, faster than any known aircraft, and they remained silent, or made only a very slight noise, even when hovering or accelerating.	Wilfred De Brouwer	Deputy Chief of Staff, Major General Belgian Air Force	2010 |	https://www.amazon.com/UFOs-Generals-Pilots-Government-Officials/dp/0307717089	UFOs: Generals ... p 35	
—	On the morning of Number 2, 1982... I noticed... another 'aircraft'. It didn't have wings and it didn't have a tail, only a cockpit! It was an oval shape. What kind of airplane could that be?... I flew directly to a point along the trajectory of its elliptical course. It came toward me and flew right over me, on top of my aircraft, and stopped there, like a helicopter landing but much, much faster, breaking all the rules of aerodynamics. It was very close to my plane, only about 15 feet. I was astonished. I closed my eyes and I froze at this moment without reacting. There was no impact... It then flew off in a flash... One of the other pilots saw the whole thing... Right after landing, all three of us filed detailed, independent written reports about the incident.	Julio Miguel Guerra	Captain, Portuguese Air Force	2010 |	https://www.amazon.com/UFOs-Generals-Pilots-Government-Officials/dp/0307717089	UFOs: Generals ... p 49	
—	On April 11, 1980 at 7:15 am...The squad commander... ordered me to take off ... to intercept the balloon before it got any closer to our base... Zeroing in on the balloon... I shot a burst of sixty-four 30mm shells, which created a cone-shaped 'wall of fire' that would normally obliterate anything in its path... but nothing happened. Then suddenly the object began to ascend very rapidly and head away from the base... I initiated a chase... at a speed of 600 mph and the 'balloon' remained about 1,600 feet in front of me... [up to] 36,000 feet. It came to a sudden stop and forced me to veer to the side... It eluded my attack three times, each time at the very last moment. We reached an altitude of 63,000 feet and suddenly the thing stopped completely and remained stationary... I got as close as about 300 feet from it. I was startled to see that the 'balloon' was not a balloon at all. It was an object that measured about 35 feet in diameter... It lacked all the typical components of aircraft. It had no wings, propulsion jets, exhausts, windows, antennae, and so forth. It had no visible propulsion system. At that moment, I realized this was not a spying device but a UFO, something totally unknown... Suddenly, I was afraid.	Oscar Santa Maria Huertas	Comandante, Peruvian Air Force	2010 |	https://www.amazon.com/UFOs-Generals-Pilots-Government-Officials/dp/0307717089	UFOs: Generals ... p 89	
—	December 9, 1979 at around 9:15 am... The object [had] a precise contour, a gray metal color on the top and dark blue below, with no lights or portholes. It went about three meters from the ground, not stabilized, and then rose to the level of the trees [250 meters away], while continuously oscillating, then went down again slightly and stopped. It went up a little once again, always while oscillating; it tilted and accelerated quickly to reach a speed much higher than that of a Mirage III [French fighter jet capable of Mach 2], and disappeared.	Jean-Pierre Fartek	Captain, French Air Force	1979 |	https://www.amazon.com/UFOs-Generals-Pilots-Government-Officials/dp/0307717089	UFOs: Generals ... p 124	
—	An outstanding report: this [1976 Tehran] case is a classic which meets all the criteria necessary for a valid study of the UFO phenomenon. The object was seen by multiple witnesses from different locations... and viewpoints. The credibility of many of the witnesses was high (an Air Force General, qualified aircrews and experienced tower operators). Visual sightings were confirmed by radar. Similar electromagnetic effects were reported by three separate aircraft. There were physiological effects on some crew members (i.e., loss of night vision due to the brightness of the object). An inordinate amount of maneuverability was displayed by the UFOs.	Roland Evans	Major Colonel, Defense Intelligence Agency	10/12/1976 |	https://www.amazon.com/UFOs-Generals-Pilots-Government-Officials/dp/0307717089	UFOs: Generals ... p 150	
—	At about 11 pm on the evening of September 18, 1976, citizens were frightened by the circling of an unknown object over Tehran at a low altitude. It looked similar to a star, but bigger and brighter... And then I saw it. It was flashing with intense red, green, orange, and blue lights so bright I was not able to see its body... I approached, and I got close to it, maybe 70 miles or so in a climb situation. All of a sudden, it jumped about 10 degrees to the right, in an instant! [6.7 miles]. Ten degrees... And then it jumped 10 degrees, and then again... We now had a good [radar] return on the screen, and it was at 27 miles... At this moment, I thought this was my chance to fire at it. But it — whatever it was — was close to me, my weapons jammed and my radio communications were garbled. We got closer, to 25 miles at our twelve o'clock position. All of a sudden it jumped back to 27 miles in an instant... I was really scared... I attempted to fire, and looked at the panel to confirm my selection of the missile. Suddenly, nothing was working. The weapons control panel was out, and I lost all the instruments, and the radio. The indicator dials were spinning around randomly, and the instruments were fluctuating... [the UAP] started circling around us.	Parviz Jafari	General, Iranian Air Force	2010 |	https://www.amazon.com/UFOs-Generals-Pilots-Government-Officials/dp/0307717089	UFOs: Generals ... p 88	
USG has more data							
—	I'm glad the Pentagon is finally releasing this footage, but it only scratches the surface of research and materials available.	Harry Reid	US Senator (D)	4/27/2020 |	https://twitter.com/SenatorReid/status/1254836730546384897?ref_src=twsrc%5Etfw%7Ctwcamp%5Etweetembed%7Ctwterm%5E1254836730546384897%7Ctwgr%5E%7Ctwcon%5Es1_&ref_url=https%3A%2F%2Fwww.vice.com%2Fen%2Farticle%2F5dmnp3%2Fufo-videos-only-scratch-the-surface-of-what-the-pentagon-knows-harry-reid-says	Twitter	Senate Majority Leader
—	I am saying most of [the evidence] hasn't seen the light of day.	Harry Reid	US Senator (D)	5/16/2021 |	https://www.amazon.com/Phenomenon-John-Podesta/dp/B08HR9BVNM	The Phenomenon	Senate Majority Leader
—	I actually wanted to get this information out and declassify it before I left office but we weren't able to get it down into an unclassified format that we were able to talk about quickly enough.	John Ratcliffe	Director National Intelligence	3/22/2021 |	https://www.theguardian.com/us-news/2021/mar/22/us-government-ufo-report-sightings	Fox News	
—	If UAP do indeed represent a potential threat to our security, then the capabilities, systems, processes, and sources we use to observe, record, study or analyze these phenomena need to be classified at appropriate levels. We do not want potential adversaries to know exactly what we're able to see or understand or how we come to the conclusions we make. Therefore public disclosures must be carefully considered on a case by case basis...	Scott Bray	Deputy Director Navy Intelligence	5/17/2022 |	https://www.youtube.com/watch?v=aSDweUbGBow	Congressional hearings	
—	Finally my biggest failure of 2014, once again not securing the disclosure of UFO files.	John Podesta	Chief of Staff to President Clinton	2/13/2015 |	https://www.uap.guide/quotes/USG-has-more-data	Twitter	
—	I did attempt to discover if there were any secret government documents that reveal things, and if there were, they were concealed from me too. I wouldn't be the first president that underlings had lied to or career bureaucrats have waited out. There may be some career person sitting around somewhere hiding these dark secrets even from elected presidents, but if so they successfully eluded me and I am almost embarrassed to tell you I did try to find out.	Bill Clinton	US President (D)	2014 |	https://www.amazon.com/Phenomenon-John-Podesta/dp/B08HR9BVNM	The Phenomenon	
—	At some point, the information about 'alien' stuff and true US national defence information crosses paths. Patriots with clearances do not want to be traitors to their country or their way of life. For instance, if I told you the exact electromagnetic signature of a high-match UFO that US sensors search for, but don't attack, and you put it in a book, the Soviets/Chinese would manufacture a bomber with sigint/elint countermeasure equipment that generated that exact signature.	Bob Fish	Defense communications intelligence	2021 |	https://www.amazon.com/Plain-Sight-investigation-impossible-science/dp/1460759060	In Plain Sight, p 103	
—	If there is some recovered debris say, it is so deeply buried and squirreled away that it's outside of those normal oversight processes and that's why there is a problem in this area.	Christopher Mellon	Dep. Asst. Secretary of Defense for Intelligence	5/16/2021 |	https://www.amazon.com/Phenomenon-John-Podesta/dp/B08HR9BVNM	The Phenomenon	
USG may have materials							
—	After looking into this, I came to the conclusion that there were reports — some were substantive, some not so substantive — that there were actual [UAP] materials that the government and the private sector had in their possession... It is extremely important that information about the discovery of physical materials or retrieved craft come out.	Harry Reid	US Senator (D)	7/23/2020 |	https://www.nytimes.com/2020/07/23/us/politics/pentagon-ufo-harry-reid-navy.html	The New York Times	Senate Majority Leader
—	"[Tucker Carlson]: Do you think the US government has debris from a UFO right now? 

[Elizondo]: Aaah, simply put, yes."	Luis Elizondo	Director AATIP	5/1/2019 |	https://www.amazon.com/Plain-Sight-investigation-impossible-science/dp/1460759060	In Plain Sight, p. 244	Head of Pentagon UAP program
—	Luis Elizondo's very brief answer to Tucker Carlson's question about whether the US government is in possession of recovered, crashed, and landed UFO technology hardware is 1,000% accurate. My national security NDAs prevent me from adding any further comment to this.	Dr. Eric Davis	Astrophysicist	6/2/2019 |	https://www.amazon.com/Plain-Sight-investigation-impossible-science/dp/1460759060	In Plain Sight, p. 245	Consultant to AATIP, Pentagon UAP study program
—	"[Coulthart]: Are you able to confirm to me that the US has been trying to develop recovered alien technology? 

[Kobitz]: Yes, I can say that's so."	Nat Kobitz	Director of US Navy Science and Technology Development	2020 |	https://www.amazon.com/Plain-Sight-investigation-impossible-science/dp/1460759060	In Plain Sight, p. 282	
—	I will tell you, I have never said this before, but I have been told by multiple people who have credentials and access, that there is some truth to these stories [about Roswell]. So I don't discount this when people say this, I have had people who had substantial scientific or military credentials, that they believe it is true. So I encourage people on the Hill to pursue it.	Christopher Mellon	Dep. Asst. Secretary of Defense for Intelligence	5/30/2021 |	https://www.youtube.com/watch?v=RjV-PZyUwlY	The Joe Rogan Experience	
